file,expected_filename,expected_alt_text,expected_caption
doctor-consultation.png,primary-care-consultation,A clinician discusses care with a patient during a primary care consultation.,A calm primary care consultation between a clinician and patient.
family-clinic-reception.png,family-health-clinic-reception,A welcoming clinic reception area with a family checking in for an appointment.,A family checks in at a welcoming health clinic reception desk.
blood-pressure-screening.png,preventive-health-screening,A clinician checks a patient's blood pressure during a preventive health screening.,A routine blood pressure check during a preventive care visit.
telehealth-appointment.png,telehealth-care-appointment,A patient joins a telehealth appointment with a clinician on a laptop screen.,A patient connects with a clinician through a telehealth appointment.
pharmacy-medication-review.png,medication-review-consultation,A healthcare professional reviews medication information with a patient.,A healthcare professional supports a patient during a medication review.
